{
  "$schema": "http://json-schema.org/draft-07/schema#",
  "title": "Per-county source-metadata registry",
  "description": "Validates a county's sources.json for the elephant-xyz ingestion pipeline.",
  "type": "object",
  "required": ["county", "state", "sources"],
  "additionalProperties": true,
  "properties": {
    "county": { "type": "string" },
    "state": { "type": "string" },
    "registry_version": { "type": "integer" },
    "last_verified": {
      "description": "Stamped by the caller after live URL verification; null until then.",
      "type": ["string", "null"]
    },
    "sources": {
      "type": "array",
      "minItems": 1,
      "items": { "$ref": "#/definitions/source" }
    }
  },
  "definitions": {
    "source": {
      "type": "object",
      "required": ["id", "category", "provider", "urls", "access_pattern", "refresh_method"],
      "additionalProperties": true,
      "properties": {
        "id": { "type": "string" },
        "category": {
          "type": "string",
          "enum": ["property_appraisal", "permits", "business_registry", "business_reputation"]
        },
        "provider": { "type": "string" },
        "urls": {
          "type": "object",
          "additionalProperties": { "type": "string" }
        },
        "access_pattern": {
          "type": "string",
          "enum": ["browser-flow", "http-api", "bulk-download", "scrape"]
        },
        "access_details": {
          "type": "object",
          "additionalProperties": true
        },
        "batch_available": { "type": "boolean" },
        "refresh_method": { "type": "string" },
        "refresh_cadence": { "type": "string" },
        "seed": { "type": "string" },
        "scale": {
          "type": "object",
          "additionalProperties": { "type": "number" }
        },
        "completeness_check": { "type": "string" },
        "anti_bot": {
          "type": "object",
          "additionalProperties": true,
          "properties": {
            "captcha": { "type": "boolean" },
            "cloudflare_challenge": { "type": "boolean" },
            "bot_challenges": { "type": "boolean" },
            "us_egress_required_for_local_probing": { "type": "boolean" },
            "concurrency": { "type": "string" },
            "notes": { "type": "string" }
          }
        },
        "gotchas": {
          "type": "array",
          "items": { "type": "string" }
        },
        "known_gaps": {
          "type": "array",
          "items": { "type": "string" }
        },
        "downstream": {
          "type": "array",
          "items": { "type": "string" }
        },
        "matching": { "type": "string" }
      }
    }
  }
}
